{
 "schema": "pqc/packaging@1",
 "episode_id": "C01-E008",
 "title": "Wending Mill | Nat 20 Pixels C1E8",
 "description": "Goblins are battering at the door of a watermill, and the people of Wending Mill are behind it.\nThe party is four miles away. They run.\n\nEpisode 8 of a daily pixel-art D&D 5e story. Brannoc, Ilsevel, Tamsin and Oriel answer Captain Rook's letter and find the hamlet of Wending Mill under attack. A race down the road, a fight in the mill yard, and smoke where there should not be smoke. Every check and attack is decided by real, seeded dice shown on screen: no rerolls, no fudging.\n\nNew episode every weekday. Characters, quotes and every roll are on the wiki.",
 "tags": ["Nat 20 Pixels", "D&D 5e", "Dungeons and Dragons", "pixel art", "actual play", "fantasy story", "goblins", "watermill", "Brannoc", "Ilsevel", "Tamsin", "Oriel", "Pell", "Wending Mill"],
 "thumbnail_text": "RUN!",
 "thumbnail_moment": "e1:11"
}
