{
 "schema": "pqc/packaging@1",
 "episode_id": "C01-E005",
 "title": "The Scout Camp | Nat 20 Pixels C1E5",
 "description": "Firelight in the woods, goblin voices, and a cart that leaves at dawn.\nThe party is hurt, out of spells, and Tamsin has a plan that involves walking in alone.\n\nEpisode 5 of a daily pixel-art D&D 5e story. Brannoc, Ilsevel, Tamsin and Oriel follow the goblin trail to a scout camp deep in Thornpike Woods. A group stealth check, one very confident lie, and whatever is waiting in the cart. Every check and attack is decided by real, seeded dice shown on screen: no rerolls, no fudging.\n\nNew episode every weekday. Characters, quotes and every roll are on the wiki.",
 "tags": ["Nat 20 Pixels", "D&D 5e", "Dungeons and Dragons", "pixel art", "actual play", "fantasy story", "goblins", "stealth", "bluff", "Brannoc", "Ilsevel", "Tamsin", "Oriel", "Thornpike Woods"],
 "thumbnail_text": "THE BOSS SENT ME",
 "thumbnail_moment": "s2"
}
