{"schema": "pqc/packaging@1", "episode_id": "C01-E004", "title": "Wolves at the Birches | Nat 20 Pixels C1E4", "description": "Night falls in Thornpike Woods, and the goblin trail splits three ways in the dark.\nIlsevel has a spell for exactly this. She has just never cast it before.\n\nEpisode 4 of a daily pixel-art D&D 5e story. Brannoc, Ilsevel, Tamsin and Oriel follow the goblins into the forest at night. A ritual by a dead stump, a new and very opinionated companion, and something circling the birch clearing. Every check, attack and spell is decided by real, seeded dice shown on screen: no rerolls, no fudging.\n\nNew episode every weekday. Characters, quotes and every roll are on the wiki.", "tags": ["Nat 20 Pixels", "D&D 5e", "Dungeons and Dragons", "pixel art", "actual play", "fantasy story", "wolves", "familiar", "owl", "Pell", "Brannoc", "Ilsevel", "Tamsin", "Oriel", "Thornpike Woods"], "thumbnail_text": "SOMETHING IN THE TREES", "thumbnail_moment": "e1:2", "short": {"title": "The wolf rolls a natural 20 | Nat 20 Pixels", "hook": "NATURAL 20. FOR THE WOLF.", "description": "Three starving wolves in a birch clearing at night. One of them rolls a natural 20, and Tamsin never sees it coming."}}
