{"schema": "pqc/packaging@1", "episode_id": "C01-E009", "title": "Smoke Over the Millpond | Nat 20 Pixels C1E9", "description": "The barn is burning with two people inside, and the goblins who lit it are still here.\nNobody has a spell left. Somebody is going to fall.\n\nEpisode 9 of a daily pixel-art D&D 5e story. At Wending Mill, Brannoc, Ilsevel, Tamsin and Oriel fight to get the villagers out of a burning barn, and then face the one giving the goblins their orders. Death saves are real, and every one of them is rolled on screen with seeded dice: no rerolls, no fudging.\n\nNew episode every weekday. Characters, quotes and every roll are on the wiki.", "tags": ["Nat 20 Pixels", "D&D 5e", "Dungeons and Dragons", "pixel art", "actual play", "fantasy story", "goblin boss", "death saves", "Brannoc", "Ilsevel", "Tamsin", "Oriel", "Wending Mill"], "thumbnail_text": "STILL BREATHING", "thumbnail_moment": "e1:12", "short": {"title": "The dwarf who will not move | Nat 20 Pixels", "hook": "HE WON'T LET HER FALL", "description": "Oriel is down and making death saves. Brannoc stands over her and takes every blow. Then a fire bolt comes from behind him."}}
