{"schema": "pqc/packaging@1", "episode_id": "C01-E006", "title": "First Watch | Nat 20 Pixels C1E6", "description": "Four strangers, one campfire, and a long night in Thornpike Woods.\nNo goblins tonight. Just the things people notice about each other in the dark.\n\nEpisode 6 of a daily pixel-art D&D 5e story. After a raid, a stolen lantern-core, wolves and a goblin camp, Brannoc, Ilsevel, Tamsin and Oriel make their first camp together beside an old stone in a hollow. Somebody reads somebody else's notebook, somebody keeps the first watch, and somebody's shield has a secret under the paint. The few rolls tonight are real, seeded dice shown on screen.\n\nNew episode every weekday. Characters, quotes and every roll are on the wiki.", "tags": ["Nat 20 Pixels", "D&D 5e", "Dungeons and Dragons", "pixel art", "actual play", "fantasy story", "campfire", "found family", "Brannoc", "Ilsevel", "Tamsin", "Oriel", "Pell", "Thornpike Woods"], "thumbnail_text": "FIRST WATCH", "thumbnail_moment": "s3", "short": {"title": "First watch by the campfire | Nat 20 Pixels", "hook": "SHE SLEEPS WITH A CANDLE", "description": "No goblins tonight. A dwarf who counts everything, a priestess afraid of the dark, and a small lantern changing hands."}}
