{"schema": "pqc/packaging@1", "episode_id": "C01-E007", "title": "The Saint of the Open Hand | Nat 20 Pixels C1E7", "description": "Home to Brindle Cross, with three dead lantern-cores and no lit lantern.\nAn old priest has two stories to tell tonight. One of them is Oriel's.\n\nEpisode 7 of a daily pixel-art D&D 5e story. Brannoc, Ilsevel, Tamsin and Oriel return to the Crooked Kettle, where Father Tobin tells the tale of Saint Wenna by the hearth, and of the frost night he found a baby at the foot of the oldest lantern on the road. Then the door bangs open. Every roll is decided by real, seeded dice shown on screen.\n\nNew episode every weekday. Characters, quotes and every roll are on the wiki.", "tags": ["Nat 20 Pixels", "D&D 5e", "Dungeons and Dragons", "pixel art", "actual play", "fantasy story", "Father Tobin", "Saint Wenna", "Brannoc", "Ilsevel", "Tamsin", "Oriel", "Brindle Cross", "Crooked Kettle"], "thumbnail_text": "THE OPEN HAND", "thumbnail_moment": "s2", "short": {"title": "A letter for someone called Bran Vow | Nat 20 Pixels", "hook": "WHO IS BRAN VOW?", "description": "A second lantern goes dark, and a rider leaves a letter for a name nobody at the inn has heard. Brannoc reads it without a word."}}
