{"schema": "pqc/packaging@1", "episode_id": "C01-E003", "title": "The Empty Housing | Nat 20 Pixels C1E3", "description": "Lantern Thirty-Seven burned for three hundred years and went out in a single night. Today the party walks out to find out why.\nA lantern cannot simply go out. So what happened to this one?\n\nEpisode 3 of a daily pixel-art D&D 5e story. Brannoc, Ilsevel, Tamsin and Oriel walk the Lantern Road to the dead lantern, where the grass has turned grey in broad daylight and the glass is cold to the touch. A frozen lock, a scholar's eye, a soldier reading the ground at dusk: every check is decided by real, seeded dice shown on screen, with no rerolls.\n\nNew episode every weekday. Characters, quotes and every roll are on the wiki.", "tags": ["Nat 20 Pixels", "D&D 5e", "Dungeons and Dragons", "pixel art", "actual play", "fantasy story", "investigation", "Brannoc", "Ilsevel", "Tamsin", "Oriel", "Lantern Road", "Thornpike Woods", "Lantern 37"], "thumbnail_text": "THE LIGHT WAS TAKEN", "thumbnail_moment": "s2", "short": {"title": "A frozen lock, a hairpin and an empty lantern | Nat 20 Pixels", "hook": "NOT BROKEN. TAKEN.", "description": "A lantern that burned for three hundred years went dark overnight. Tamsin picks the frozen lock, and the empty housing tells them something worse."}}
