{"schema": "pqc/packaging@1", "episode_id": "C01-E010", "title": "Fort Harrow | Nat 20 Pixels C1E10", "description": "The far end of the Lantern Road: a tired fort, forty soldiers, and a captain who needs help.\nAt the gate, someone says a name Brannoc has never said out loud.\n\nEpisode 10 of a daily pixel-art D&D 5e story, and the end of the first act. Brannoc, Ilsevel, Tamsin and Oriel bring their report to Captain Rook at Fort Harrow, get hired, try to haggle, and are shown something a patrol took off a dead goblin that evening. Every roll is decided by real, seeded dice shown on screen.\n\nNew episode every weekday. Characters, quotes and every roll are on the wiki.", "tags": ["Nat 20 Pixels", "D&D 5e", "Dungeons and Dragons", "pixel art", "actual play", "fantasy story", "Captain Rook", "Fort Harrow", "Brannoc", "Ilsevel", "Tamsin", "Oriel", "Lantern Road", "mystery"], "thumbnail_text": "SHORT VERSION", "thumbnail_moment": "s2", "short": {"title": "The shortest report in history | Nat 20 Pixels", "hook": "REPORT. SHORT VERSION.", "description": "Captain Rook asks for the short version. Brannoc delivers. Then Tamsin tries to haggle with an army captain."}}
