{
 "schema": "pqc/packaging@1",
 "episode_id": "C01-E002",
 "title": "The Goblin Who Talked | Nat 20 Pixels C1E2",
 "description": "One goblin survived last night's raid on Brindle Cross. He has been tied to a rain barrel all night, and he hasn't said a word.\nThis morning, someone is going to make him talk: with a loaf of bread, or with a very large dwarf.\n\nEpisode 2 of a daily pixel-art D&D 5e story. Oriel and Brannoc question their captive outside the Crooked Kettle, Ilsevel tries to read a goblin's face for the first time, and Tamsin finds out that the Professor notices more than she lets on. Every check is decided by real, seeded dice shown on screen: no rerolls, no fudging.\n\nNew episode every weekday. Characters, quotes and every roll are on the wiki.",
 "tags": ["Nat 20 Pixels", "D&D 5e", "Dungeons and Dragons", "pixel art", "actual play", "fantasy story", "goblin", "Rusk", "Brannoc", "Ilsevel", "Tamsin", "Oriel", "Maddy Fenn", "Brindle Cross", "Crooked Kettle"],
 "thumbnail_text": "MAKE HIM TALK",
 "thumbnail_moment": "s2"
}
